{
  "brief_hash": "sha256:8170e610eacc1ce014a825eaf111087beeec57d62a2ff80595be24653d9df659",
  "content_dir": "works/TK-003",
  "contract_revision": 2,
  "created_at": "2026-09-06T15:36:37.295440Z",
  "documentation": {
    "impact": {
      "posture": "required",
      "required_documents": [
        "DOC-TODOLIST-BEHAVIOR"
      ]
    }
  },
  "id": "TK-003",
  "kind": "ticket",
  "materialization": "R0",
  "qa": {
    "impact": {
      "posture": "none",
      "rationale": "read-only projection of the already-covered pending filter;"
    }
  },
  "revision": 4,
  "risk": "low",
  "role": "implementation",
  "schema_version": 1,
  "status": "ready",
  "title": "Show the pending count with a count command",
  "updated_at": "2026-09-06T15:45:25.893762Z"
}
