{
  "brief_hash": "sha256:4bda0176c485eb555a47946bbd64a58193a0cf80b03acb61307d1564215ec3f1",
  "content_dir": "works/TK-007",
  "contract_revision": 2,
  "created_at": "2026-09-06T15:36:37.626455Z",
  "documentation": {
    "impact": {
      "posture": "required",
      "required_documents": [
        "DOC-TODOLIST-BEHAVIOR"
      ]
    }
  },
  "id": "TK-007",
  "kind": "ticket",
  "materialization": "R1",
  "qa": {
    "impact": {
      "posture": "none",
      "rationale": "domain mutation contract pinned by focused verify tests;"
    }
  },
  "revision": 4,
  "risk": "low",
  "role": "implementation",
  "schema_version": 1,
  "status": "ready",
  "title": "Rename a todo in place",
  "updated_at": "2026-09-06T15:45:26.156693Z"
}
