{
  "brief_hash": "sha256:d3bf7f15489e935ec25d5c9fa085ab07233787bf1092eb96abe5a616f912792a",
  "content_dir": "works/TK-002",
  "contract_revision": 2,
  "created_at": "2026-09-05T17:08:59.639234Z",
  "documentation": {
    "impact": {
      "posture": "required",
      "required_documents": [
        "DOC-TODOLIST-BEHAVIOR"
      ]
    }
  },
  "id": "TK-002",
  "kind": "ticket",
  "materialization": "R1",
  "qa": {
    "impact": {
      "posture": "none",
      "rationale": "read-only listing; completion behavior itself is unchanged."
    }
  },
  "revision": 11,
  "risk": "low",
  "role": "implementation",
  "schema_version": 1,
  "status": "done",
  "title": "List completed todos in the CLI",
  "updated_at": "2026-09-05T17:41:51.483068Z"
}
