{
  "content_dir": "works/ST-001",
  "contract_revision": 1,
  "created_at": "2026-09-05T14:04:22.839639Z",
  "id": "ST-001",
  "kind": "story",
  "revision": 2,
  "schema_version": 1,
  "status": "shaped",
  "title": "Todos can be completed reliably",
  "updated_at": "2026-09-05T14:06:27.637619Z"
}
