{
  "brief_hash": "sha256:3a0aaa6098eede98930da328155f0ae5adbbc30195f5a99c39f206ece3b30a2b",
  "content_dir": "works/TK-006",
  "contract_revision": 2,
  "created_at": "2026-09-06T15:36:37.552830Z",
  "documentation": {
    "impact": {
      "posture": "none",
      "rationale": "the strategy lands in a Decision record on acceptance; the"
    }
  },
  "id": "TK-006",
  "kind": "ticket",
  "materialization": "R1",
  "qa": {
    "impact": {
      "posture": "none",
      "rationale": "research-only ticket; no behavior surface exists to check."
    }
  },
  "revision": 7,
  "risk": "medium",
  "role": "decision_work",
  "schema_version": 1,
  "status": "done",
  "title": "Decide the state-file schema evolution strategy",
  "updated_at": "2026-09-06T18:20:16.687694Z"
}
